{
  "schemaVersion": 1,
  "id": "shadcn-ui",
  "title": "shadcn/ui",
  "summary": "React component primitives, owned by project",
  "zone": "inventory",
  "kind": "library",
  "status": "ready",
  "tags": [
    "react",
    "ui"
  ],
  "source": {
    "type": "local",
    "path": "inventory/libraries/shadcn-ui/README.md"
  },
  "mode": "reference"
}
