{
  "schemaVersion": 1,
  "id": "fumadocs-engineer",
  "title": "Fumadocs Engineer",
  "summary": "Verified Fumadocs integrations",
  "zone": "skill-tree",
  "kind": "skill",
  "status": "ready",
  "tags": [
    "fumadocs",
    "docs"
  ],
  "source": {
    "type": "local",
    "path": "skill-tree/skills/fumadocs-engineer/SKILL.md"
  },
  "mode": "reference"
}
