{
  "schemaVersion": 1,
  "id": "diataxis-docs-framework",
  "title": "Diátaxis Docs Framework",
  "summary": "Source for task-oriented documentation design, maturity audits, templates, writing quality and Diátaxis methods.",
  "zone": "skill-tree",
  "kind": "skill",
  "status": "ready",
  "tags": [
    "fumadocs",
    "docs",
    "external"
  ],
  "source": {
    "type": "local",
    "path": "skill-tree/skills/diataxis-docs-framework/README.md"
  },
  "mode": "reference",
  "notes": "https://github.com/anivar/developer-docs-framework — third-party reference, not installed; Its taxonomy is a method, not a mandatory directory structure; keep BAG's arbitrary nesting."
}
