{
  "schemaVersion": 1,
  "id": "repository-auditor",
  "title": "Repository Auditor",
  "summary": "Assess existing architecture before reuse",
  "zone": "skill-tree",
  "kind": "skill",
  "status": "ready",
  "tags": [
    "audit",
    "ai"
  ],
  "source": {
    "type": "local",
    "path": "skill-tree/skills/repository-auditor/SKILL.md"
  },
  "mode": "reference"
}
